{
  "id": "1987-10-29_constitution-10",
  "date": "1987-10-29",
  "kind": "constitution",
  "title": "헌법 제10호 전부개정",
  "assembly": 12,
  "source_urls": [
    "https://www.law.go.kr/%EB%B2%95%EB%A0%B9/%EB%8C%80%ED%95%9C%EB%AF%BC%EA%B5%AD%ED%97%8C%EB%B2%95/(00010,19871029)"
  ],
  "verified": false,
  "checked_at": "2026-10-22",
  "note": "date는 공포일. 그날 재임 중이던 국회가 assembly"
}
